{
  "schemaVersion": 1,
  "themeId": "hydracore.theme.300mind",
  "displayName": "300Mind Casual UI",
  "version": "0.2.0",
  "styleTags": [
    "casual",
    "mobile",
    "rounded",
    "high-contrast",
    "cyan-purple"
  ],
  "assets": [
    { "semanticRole": "icon.shop", "assetGuid": "7f9865cf6ac20f7468e13d5a5daff8ef", "spriteName": "UI-pack_Sprite_1_0", "imageMode": "simple", "preserveAspect": true, "scale": 0.72 },
    { "semanticRole": "icon.home", "assetGuid": "7f9865cf6ac20f7468e13d5a5daff8ef", "spriteName": "UI-pack_Sprite_1_2", "imageMode": "simple", "preserveAspect": true, "scale": 0.72 },
    { "semanticRole": "icon.settings", "assetGuid": "7f9865cf6ac20f7468e13d5a5daff8ef", "spriteName": "UI-pack_Sprite_1_4", "imageMode": "simple", "preserveAspect": true, "scale": 1.0 },
    { "semanticRole": "status.resource", "assetGuid": "7f9865cf6ac20f7468e13d5a5daff8ef", "spriteName": "UI-pack_Sprite_1_7", "imageMode": "sliced", "preserveAspect": false, "scale": 1.0, "border": [30, 30, 30, 30] },
    { "semanticRole": "icon.currency", "assetGuid": "7f9865cf6ac20f7468e13d5a5daff8ef", "spriteName": "UI-pack_Sprite_1_16", "imageMode": "simple", "preserveAspect": true, "scale": 0.72 },
    { "semanticRole": "surface.item-slot", "assetGuid": "7f9865cf6ac20f7468e13d5a5daff8ef", "spriteName": "UI-pack_Sprite_1_20", "imageMode": "sliced", "preserveAspect": false, "scale": 1.0, "border": [22, 22, 22, 22] },
    { "semanticRole": "button.primary", "assetGuid": "7f9865cf6ac20f7468e13d5a5daff8ef", "spriteName": "UI-pack_Sprite_1_21", "imageMode": "sliced", "preserveAspect": false, "scale": 1.0, "border": [46, 46, 46, 46] },
    { "semanticRole": "button.purchase", "assetGuid": "7f9865cf6ac20f7468e13d5a5daff8ef", "spriteName": "UI-pack_Sprite_1_21", "imageMode": "sliced", "preserveAspect": false, "scale": 1.0, "border": [46, 46, 46, 46] },
    { "semanticRole": "navigation.normal", "assetGuid": "7f9865cf6ac20f7468e13d5a5daff8ef", "spriteName": "UI-pack_Sprite_1_35", "imageMode": "sliced", "preserveAspect": false, "scale": 1.0, "border": [60, 46, 60, 46] },
    { "semanticRole": "progress.fill", "assetGuid": "7f9865cf6ac20f7468e13d5a5daff8ef", "spriteName": "UI-pack_Sprite_1_36", "imageMode": "filled", "preserveAspect": false, "scale": 1.0, "border": [32, 30, 32, 30] },
    { "semanticRole": "icon.video", "assetGuid": "7f9865cf6ac20f7468e13d5a5daff8ef", "spriteName": "UI-pack_Sprite_1_61", "imageMode": "simple", "preserveAspect": true, "scale": 0.82 },
    { "semanticRole": "button.close", "assetGuid": "7f9865cf6ac20f7468e13d5a5daff8ef", "spriteName": "UI-pack_Sprite_1_79", "imageMode": "simple", "preserveAspect": true, "scale": 1.0 },
    { "semanticRole": "surface.popup", "assetGuid": "39e0242329775814891ef673e48ae932", "spriteName": "UI-pack_Sprite_2_0", "imageMode": "sliced", "preserveAspect": false, "scale": 1.0, "border": [90, 90, 90, 90] },
    { "semanticRole": "surface.title", "assetGuid": "39e0242329775814891ef673e48ae932", "spriteName": "UI-pack_Sprite_2_1", "imageMode": "sliced", "preserveAspect": false, "scale": 1.0, "border": [70, 55, 70, 55] },
    { "semanticRole": "navigation.selected", "assetGuid": "39e0242329775814891ef673e48ae932", "spriteName": "UI-pack_Sprite_2_1", "imageMode": "sliced", "preserveAspect": false, "scale": 1.0, "border": [70, 55, 70, 55] },
    { "semanticRole": "surface.media", "assetGuid": "39e0242329775814891ef673e48ae932", "spriteName": "UI-pack_Sprite_2_2", "imageMode": "sliced", "preserveAspect": false, "scale": 1.0, "border": [90, 90, 90, 90] },
    { "semanticRole": "surface.offer-card", "assetGuid": "39e0242329775814891ef673e48ae932", "spriteName": "UI-pack_Sprite_2_5", "imageMode": "sliced", "preserveAspect": false, "scale": 1.0, "border": [65, 55, 65, 55] },
    { "semanticRole": "action.side", "assetGuid": "39e0242329775814891ef673e48ae932", "spriteName": "UI-pack_Sprite_2_9", "imageMode": "sliced", "preserveAspect": false, "scale": 1.0, "border": [40, 38, 40, 38] },
    { "semanticRole": "icon.collection", "assetGuid": "39e0242329775814891ef673e48ae932", "spriteName": "UI-pack_Sprite_2_13", "imageMode": "simple", "preserveAspect": true, "scale": 0.72 },
    { "semanticRole": "button.play", "assetGuid": "39e0242329775814891ef673e48ae932", "spriteName": "UI-pack_Sprite_2_16", "imageMode": "sliced", "preserveAspect": false, "scale": 1.0, "border": [50, 38, 50, 38] }
  ]
}
